<?xml version="1.0" encoding="UTF-8"?>
<xs:schema xmlns:xs="http://www.w3.org/2001/XMLSchema">

    <xs:element name="biblioteca">
        <xs:complexType>
            <xs:sequence>
                <xs:element name="libro" minOccurs="0" maxOccurs="unbounded">
                    <xs:complexType>
                        <xs:sequence>
                            <xs:element name="titulo" type="xs:string"/>
                            <xs:element name="autor">
                                <xs:complexType>
                                    <xs:sequence>
                                        <xs:element name="nombre" type="xs:string">
                                        </xs:element>
                                    </xs:sequence>
                                    <xs:attribute name="nacionalidad" type="xs:string"/>
                                </xs:complexType>
                            </xs:element>
                            <xs:element name="genero" type="xs:string">
                            </xs:element>
                        </xs:sequence>
                        <xs:attribute name="isbn" type="xs:string" use="required"/>
                        <xs:attribute name="aÃ±o" type="xs:gYear" use="required"/>
                    </xs:complexType>
                </xs:element>
            </xs:sequence>
        </xs:complexType>
    </xs:element>
</xs:schema>